<?xml version="1.0" encoding="UTF-8"?>
<thing:thing-descriptions bindingId="${bindingId}"
	xmlns:xsi="http://www.w3.org/2001/XMLSchema-instance"
	xmlns:thing="https://openhab.org/schemas/thing-description/v1.0.0"
	xsi:schemaLocation="https://openhab.org/schemas/thing-description/v1.0.0 https://openhab.org/schemas/thing-description-1.0.0.xsd">

	<!-- Sample Thing Type -->
	<thing-type id="sample">
		<label>${bindingIdCamelCase} Binding Thing</label>
		<description>Sample thing for ${bindingIdCamelCase} Binding</description>

		<channels>
			<channel id="channel1" typeId="sample-channel"/>
		</channels>

		<config-description>
			<parameter name="config1" type="text" required="true">
				<label>Sample Parameter</label>
				<description>This is a sample text configuration parameter</description>
			</parameter>
		</config-description>

	</thing-type>

	<!-- Sample Channel Type -->
	<channel-type id="sample-channel">
		<item-type>${bindingId}Item</item-type>
		<label>${bindingIdCamelCase} Binding Channel</label>
		<description>Sample channel for ${bindingIdCamelCase} Binding</description>
	</channel-type>

</thing:thing-descriptions>
