<?xml version="1.0" encoding="UTF-8"?>
<thing:thing-descriptions bindingId="hue"
    xmlns:xsi="http://www.w3.org/2001/XMLSchema-instance"
    xmlns:thing="http://eclipse.org/smarthome/schemas/thing-description/v1.0.0"
    xsi:schemaLocation="http://eclipse.org/smarthome/schemas/thing-description/v1.0.0 http://eclipse.org/smarthome/schemas/thing-description-1.0.0.xsd">

    <thing-type id="MyThingType">
        <label>My Thing Type</label>
        <description>My Thing Type</description>

        <config-description>
            <parameter name="myID" type="text">
                <label>My ID</label>
                <description>My ID.</description>
            </parameter>
        </config-description>
    </thing-type>
</thing:thing-descriptions>
