<?xml version="1.0" encoding="UTF-8"?>
<thing:thing-descriptions bindingId="somebinding"
	xmlns:xsi="http://www.w3.org/2001/XMLSchema-instance"
	xmlns:thing="https://openhab.org/schemas/thing-description/v1.0.0"
	xsi:schemaLocation="https://openhab.org/schemas/thing-description/v1.0.0 https://openhab.org/schemas/thing-description-1.0.0.xsd">

	<thing-type id="something">

		<label>Something</label>

		<channels>
			<channel id="channelPlain" typeId="string">
				<label>Channel Plain Label</label>
				<description>Channel Plain Description</description>
			</channel>
			<channel id="channelInplace" typeId="channel-with-i18n">
				<label>@text/channelInplaceLabel</label>
				<description>@text/channelInplaceDescription</description>
			</channel>
		</channels>
	</thing-type>

	<channel-type id="channel-with-i18n">
		<item-type>Number</item-type>
		<label>@text/channelLabel</label>
		<description>@text/channelDescription</description>
		<command>
			<options>
				<option value="ALARM">Alarm</option>
				<option value="LONG_ALARM"/>
			</options>
		</command>
	</channel-type>

	<channel-group-type id="channelgroup-with-i18n">

		<label>@text/channelGroupLabel</label>
		<description>@text/channelGroupDescription</description>

		<channels>
			<channel id="channelPlain" typeId="string">
				<label>Channel Plain Label</label>
				<description>Channel Plain Description</description>
			</channel>
			<channel id="channelInplace" typeId="channel-with-i18n">
				<label>@text/channelInplaceLabel</label>
				<description>@text/channelInplaceDescription</description>
			</channel>
		</channels>
	</channel-group-type>

</thing:thing-descriptions>
