<?xml version="1.0" encoding="UTF-8"?>
<thing:thing-descriptions bindingId="yahooweather"
	xmlns:xsi="http://www.w3.org/2001/XMLSchema-instance"
	xmlns:thing="http://eclipse.org/smarthome/schemas/thing-description/v1.0.0"
	xsi:schemaLocation="http://eclipse.org/smarthome/schemas/thing-description/v1.0.0 http://eclipse.org/smarthome/schemas/thing-description-1.0.0.xsd">

	<!-- YahooWeather Binding -->
	<thing-type id="weather">
		<label>Weather Information *</label>
		<description>@text/CUSTOM_KEY</description>

		<channels>
			<channel id="temperature" typeId="temperature" />
			<channel id="minTemperature" typeId="temperature">
				<label>Min. Temperature</label>
				<description>Minimum temperature in degrees celsius (metric) or fahrenheit (imperial).</description>
			</channel>
		</channels>
	</thing-type>

	<!-- YahooWeather Binding with group -->
	<thing-type id="weather-with-group">
		<label>Weather Information with Group</label>

		<channel-groups>
			<channel-group id="forecastToday" typeId="forecast">
				<label>Today</label>
				<description>This is the weather forecast for today.</description>
			</channel-group>
			<channel-group id="forecastTomorrow" typeId="forecast">
				<label>Weather Forecast Tomorrow</label>
				<description>This is the weather forecast for tomorrow.</description>
			</channel-group>
		</channel-groups>
	</thing-type>

	<!-- Channel Group -->
	<channel-group-type id="forecast">
		<label>Weather information group</label>
		<description>Weather information group description.</description>
		<channels>
			<channel id="temperature" typeId="temperature" />
			<channel id="minTemperature" typeId="temperature">
				<label>Min. Temperature</label>
				<description>Minimum forecasted temperature in degrees celsius (metric) or fahrenheit (imperial).</description>
			</channel>
			<channel id="maxTemperature" typeId="temperature">
				<label>Max. Temperature</label>
				<description>Maximum forecasted temperature in degrees celsius (metric) or fahrenheit (imperial).</description>
			</channel>
		</channels>
	</channel-group-type>

	<!-- Channel -->
	<channel-type id="temperature">
		<item-type>Number</item-type>
		<label>Temperature</label>
		<description>Temperature in degrees celsius (metric) or fahrenheit (imperial).</description>
		<state pattern="%d degree Celsius">
			<options>
				<option value="VALUE">My label</option>
			</options>
		</state>
	</channel-type>

</thing:thing-descriptions>
